{
  "schemaVersion": 1,
  "generatedUtc": "2026-10-28T08:02:32Z",
  "candidate": {
    "id": "a6adfc44db8813e344faff05402ca97a",
    "strategy": "keltner-breakout",
    "family": "vol-breakout",
    "version": 1,
    "parameters": {
      "emaLen": 48,
      "bandMult": 2,
      "atrMult": 3
    },
    "identity": {
      "strategy": "keltner-breakout",
      "strategyVersion": 1,
      "parameters": {
        "atrMult": 3,
        "bandMult": 2,
        "emaLen": 48
      },
      "symbol": "BTCUSDT",
      "intervalMinutes": 60,
      "devFromMs": 1609459200000,
      "devToMs": 1704067200000,
      "initialCapital": 10000,
      "costs": {
        "commissionRate": 0.0004,
        "slippageRate": 0.0002,
        "fundingScale": 1,
        "adverseFundingRate": null
      },
      "fundingEnabled": true,
      "sizing": {
        "mode": "RiskPerTrade",
        "fraction": 1,
        "riskPerTrade": 0.01,
        "volTargetAnnual": 0.2,
        "volLookbackBars": 720
      },
      "risk": {
        "maxLeverage": 1,
        "maxDrawdownStop": null,
        "dailyLossStop": null
      },
      "engineVersion": "1",
      "codeFingerprint": "a7e8044f07714b99",
      "dataFingerprint": "EE99272434D525C87AD96BD914CE6F9F"
    }
  },
  "validator": {
    "fingerprint": "53427db2580b11a584c335861d10fbb22efe78fdacebfc7aff74827c2e56fa1a",
    "configSha256": "235800a17cae50bd5bed2f7e3e56fdc4e31767972df9f9828f49736a84bbf1f8",
    "configPath": "config/hunt.json",
    "thresholds": {
      "minDeflatedSharpe": 0.95,
      "maxPbo": 0.2,
      "minPlateauScore": 0.6,
      "plateauMinProfitFactor": 1.05,
      "plateauMinSharpe": 0.3,
      "regimeMinTrades": 20,
      "maxLosingRegimes": 1,
      "regimeConcentrationMaxTradeShare": 0.3,
      "bootstrapMinSharpeP05": 0.0,
      "bootstrapMinProfitFactorP05": 1.0,
      "stressMultiplier": 2,
      "minTrackRecordConfidence": 0.95,
      "minTradesPerYear": 50
    },
    "python": "3.14.10",
    "packages": {
      "numpy": "2.5.4",
      "scipy": "1.18.1",
      "pandas": "3.1.0",
      "scikit-learn": "1.9.1",
      "purgedcv": "0.1.11",
      "holdout-backtest": "0.1.0",
      "jsonschema": "4.26.0"
    }
  },
  "window": {
    "devFrom": "2021-01-01T00:00:00Z",
    "devTo": "2024-01-01T00:00:00Z",
    "devFromMs": 1609459200000,
    "devToMs": 1704067200000
  },
  "data": {
    "bars": {
      "path": "data/bybit/BTCUSDT_60.csv",
      "sha256": "3300870521b4d1d1aafe15fea13192df1d84cde6998f5c7e30c5c20c354b7ed0"
    },
    "funding": {
      "path": "data/bybit/BTCUSDT_funding.csv",
      "sha256": "5f8e125edb6e13a208af80ce208c596d10b711d6115f403ba0542e1992978bfc"
    }
  },
  "baseline": {
    "from": "2021-01-01T00:00:00Z",
    "to": "2024-01-01T00:00:00Z",
    "years": 2.9979466119096507,
    "netProfitPct": 20.778103802976755,
    "cagrPct": 6.499635428516504,
    "maxDrawdownPct": 25.01732892542991,
    "profitFactor": 1.0777426239321708,
    "sharpe": 0.411871910145701,
    "sortino": 0.7787182486997917,
    "calmar": 0.2598053312521976,
    "trades": 499.0,
    "tradesPerYear": 166.4472602739726,
    "winRatePct": 29.65931863727455,
    "timeInMarketPct": 59.82876712328767,
    "turnoverPerYear": 147.48674002744923,
    "feesPaid": 2002.186081083214,
    "fundingReceived": -34.85891696737549,
    "slippageCost": 1001.0932451795519
  },
  "attribution": {
    "grossPnl": 5115.948623527813,
    "slippageCost": 1001.0932451795519,
    "commission": 2002.186081083214,
    "fundingReceived": -34.85891696737549,
    "netPnl": 2077.8103802976766
  },
  "multipleTesting": {
    "dailySharpe": 0.021558361081318686,
    "annualSharpe": 0.411871910145701,
    "observations": 1095,
    "skewness": 1.966008814661409,
    "kurtosis": 9.971038509464835,
    "psr": 0.7667758570510136,
    "nTrialsRaw": 5883,
    "nTrialsDistinct": 5732,
    "nTrialsEffective": 639,
    "trialSharpeVarianceRaw": 0.001631972950599338,
    "trialSharpeVarianceEffective": 0.002310453496299998,
    "expectedMaxSharpeRaw": {
      "daily": 0.15064007476570304,
      "annual": 2.877974587409878
    },
    "expectedMaxSharpeEffective": {
      "daily": 0.15023489147112123,
      "annual": 2.87023357143612
    },
    "dsrRaw": 6.486747032745601e-06,
    "dsrEffective": 6.904887997399035e-06,
    "dsrGate": 6.486747032745601e-06,
    "dsrGateBasis": "raw",
    "minBacktestLengthYears": {
      "raw": 81.96788725262635,
      "effective": 57.586414079905595,
      "devYears": 2.9979466119096507
    },
    "pboSearch": {
      "pbo": 0.5043512043512044,
      "nPartitions": 12870,
      "nConfigurations": 5731,
      "nBlocks": 16,
      "probabilityOosLoss": 0.49246309246309244,
      "degradation": {
        "slope": -0.47761226513118854,
        "intercept": 0.06079434740955251
      },
      "logitMean": 0.349515156622868,
      "crossCheck": {
        "holdout": {
          "error": "ValidationError: strategy 3452 has zero variance on part of the sample, so its Sharpe ratio is undefined there"
        },
        "purgedcv": {
          "own": 0.5142857142857142,
          "library": 0.5142857142857142,
          "absDiff": 0.0,
          "agree": null,
          "note": "both at 8 blocks; purgedcv's own block and tie conventions, small differences possible"
        }
      },
      "selectionSet": "every distinct registered trial with non-flat dev returns"
    },
    "pboLocal": {
      "pbo": 0.7343434343434343,
      "nPartitions": 12870,
      "nConfigurations": 100,
      "nBlocks": 16,
      "rows": 1095,
      "logitMean": -0.8366778939877049,
      "logitQuantiles": {
        "0.05": -3.4863551900024623,
        "0.25": -1.6700625342505353,
        "0.5": -0.9093702890295813,
        "0.75": 0.09909090264423097,
        "0.95": 1.7462970951512975
      },
      "probabilityOosLoss": 0.12315462315462315,
      "degradation": {
        "slope": -1.0029717274107466,
        "intercept": 0.0953315022376133
      },
      "meanIsSharpeOfWinner": 0.06972138080156978,
      "meanOosSharpeOfWinner": 0.025402928497600452,
      "selectionFrequency": {
        "9": 114,
        "10": 2,
        "11": 16,
        "12": 4,
        "13": 1672,
        "14": 779,
        "15": 164,
        "16": 407,
        "17": 228,
        "18": 343,
        "19": 43,
        "20": 306,
        "21": 88,
        "22": 849,
        "23": 17,
        "24": 346,
        "26": 6,
        "28": 1,
        "33": 120,
        "35": 20,
        "36": 2,
        "39": 137,
        "40": 57,
        "42": 18,
        "43": 508,
        "44": 609,
        "45": 293,
        "47": 2359,
        "48": 7,
        "49": 23,
        "51": 10,
        "53": 2,
        "55": 115,
        "56": 40,
        "57": 430,
        "59": 1257,
        "60": 392,
        "61": 1,
        "62": 29,
        "63": 455,
        "65": 1,
        "76": 3,
        "77": 15,
        "78": 7,
        "79": 19,
        "80": 61,
        "81": 190,
        "82": 174,
        "83": 98,
        "85": 3,
        "86": 4,
        "87": 16,
        "89": 7,
        "90": 2,
        "91": 1
      }
    },
    "alternativeTrialCounts": {
      "distinctSeriesWithDistinctVariance": {
        "nTrials": 5731,
        "sharpeVariance": 0.0016554377437534777
      },
      "holdoutEigenvalue": 638.9999999999986,
      "holdoutParticipation": 10.958057361723279
    }
  },
  "trackRecord": {
    "devDays": 1095,
    "minTrackRecordDays": 5581.677462233689,
    "confidence": 0.95,
    "minTrackRecordYears": 15.292267019818325
  },
  "cpcv": {
    "nGroups": 6,
    "nTestGroups": 2,
    "nSplits": 15,
    "nPaths": 5,
    "purgeHorizonDays": 20,
    "embargoDays": 10,
    "selectionSetSize": 100,
    "candidateSelectedInSplits": 0,
    "paths": [
      {
        "path": 0,
        "sharpe": 0.7106410815718218,
        "cagr": 0.1150101600356832,
        "maxDrawdown": 0.14591552652231266,
        "calmar": 0.7881968614086894,
        "totalReturn": 0.3862337689763802,
        "profitFactor": 1.2164629626309562,
        "configsUsed": [
          "c059",
          "c059",
          "c018",
          "c013",
          "c013",
          "c013"
        ]
      },
      {
        "path": 1,
        "sharpe": 0.5027453353040365,
        "cagr": 0.07384482853108776,
        "maxDrawdown": 0.1897829495853438,
        "calmar": 0.3891014903732453,
        "totalReturn": 0.23829634188035032,
        "profitFactor": 1.1421052389362905,
        "configsUsed": [
          "c018",
          "c047",
          "c047",
          "c047",
          "c047",
          "c045"
        ]
      },
      {
        "path": 2,
        "sharpe": -0.008495544165525426,
        "cagr": -0.013553543492408782,
        "maxDrawdown": 0.17441139071389467,
        "calmar": -0.07771019677632228,
        "totalReturn": -0.04011202461979202,
        "profitFactor": 0.9890457774591892,
        "configsUsed": [
          "c013",
          "c047",
          "c043",
          "c043",
          "c063",
          "c014"
        ]
      },
      {
        "path": 3,
        "sharpe": 0.10391779590719087,
        "cagr": -0.00636688277298747,
        "maxDrawdown": 0.3714030379811065,
        "calmar": -0.017142785927645957,
        "totalReturn": -0.01897929482580385,
        "profitFactor": 1.005115456223041,
        "configsUsed": [
          "c013",
          "c047",
          "c063",
          "c060",
          "c060",
          "c060"
        ]
      },
      {
        "path": 4,
        "sharpe": 0.17168192553010567,
        "cagr": 0.010524158189411548,
        "maxDrawdown": 0.3714030379811073,
        "calmar": 0.028336219990604643,
        "totalReturn": 0.03190591391874098,
        "profitFactor": 1.0165573228504645,
        "configsUsed": [
          "c013",
          "c045",
          "c014",
          "c060",
          "c060",
          "c060"
        ]
      }
    ],
    "pathSharpe": {
      "min": -0.008495544165525426,
      "median": 0.17168192553010567,
      "max": 0.7106410815718218,